{
  "schemaVersion": "1.0.0",
  "project": "BLACKED Super Update",
  "phase": 2,
  "baseline": {
    "repository": "https://github.com/bhanu13yadav1-ai/Brand-website-v2",
    "branch": "main",
    "commit": "530b6d2339e68f0ae3bd78a01ec36981d570576b",
    "capturedAt": "2026-10-22",
    "files": {
      "index.html": "007b8e7d59486b5ba93c6534aa9dcc91066d040b",
      "app.js": "245d9c4dc32a4f27e5d05eef646d97bcf8b0177a",
      "sw.js": "675093dcd5bb4d9975c40dd07d65a5cac9018ee4",
      "innerwear-image-library.json": "not re-used or changed in this phase"
    },
    "rule": "If any base file SHA changes before applying the provided patch, stop and reconcile the patch against the new source."
  },
  "principles": {
    "preserveExistingIdsAndStorageKeys": true,
    "existingSiteFilesBundled": false,
    "externalAssetRequestsFromNewGallery": false,
    "conceptImagesAreProducts": false,
    "realPaymentEnabled": false,
    "imageRightsConfirmed": false
  },
  "routes": [
    {
      "id": "route.home",
      "selector": "#view-home",
      "dataView": "home",
      "title": "Home / Discover",
      "gate": "public-existing",
      "description": "Entry point and cross-section discovery.",
      "relatedRoutes": [
        "route.stories",
        "route.innerwear",
        "route.boyfriend"
      ]
    },
    {
      "id": "route.stories",
      "selector": "#view-stories",
      "dataView": "stories",
      "title": "Stories 18+",
      "gate": "existing-self-attestation-not-formal-age-verification",
      "description": "Original fictional stories, moods, chapters and reading vault.",
      "relatedRoutes": [
        "route.boyfriend",
        "route.wellness"
      ]
    },
    {
      "id": "route.innerwear",
      "selector": "#view-innerwear",
      "dataView": "innerwear",
      "title": "Innerwear",
      "gate": "public-existing",
      "description": "Catalogue and campaign/reference concepts; concept art remains separate from verified inventory.",
      "relatedRoutes": [
        "route.boyfriend",
        "route.wellness"
      ]
    },
    {
      "id": "route.sanskari",
      "selector": "#view-sanskari",
      "dataView": "sanskari",
      "title": "Sanskari Edit / Collections",
      "gate": "public-existing",
      "description": "Existing curated collection and future collection previews.",
      "relatedRoutes": [
        "route.innerwear",
        "route.stories"
      ]
    },
    {
      "id": "route.wellness",
      "selector": "#view-wellness",
      "dataView": "wellness",
      "title": "Wellness & Size Guide",
      "gate": "existing-self-attestation-not-formal-age-verification",
      "description": "General health education and product dimension guidance, separate from human anatomy claims.",
      "relatedRoutes": [
        "route.innerwear",
        "route.boyfriend"
      ]
    },
    {
      "id": "route.boyfriend",
      "selector": "#view-boyfriend",
      "dataView": "boyfriend",
      "title": "Boyfriend & Couples",
      "gate": "existing-self-attestation-not-formal-age-verification",
      "description": "Optional couples prompts, existing wheels and movement/connection concepts.",
      "relatedRoutes": [
        "route.stories",
        "route.wellness"
      ]
    },
    {
      "id": "route.fit",
      "selector": "#view-fit",
      "dataView": "fit",
      "title": "Fit Studio",
      "gate": "public-existing",
      "description": "Existing local photo preview and notes.",
      "relatedRoutes": [
        "route.innerwear",
        "route.wellness"
      ]
    }
  ],
  "components": [
    {
      "id": "component.media-gallery",
      "kind": "component",
      "status": "new-additive",
      "purpose": "Render local campaign concepts grouped by intent, using labels and no sales claims."
    },
    {
      "id": "component.navigation-rail",
      "kind": "component",
      "status": "new-additive",
      "purpose": "Offer a small relevant next destination at the end of each existing view."
    },
    {
      "id": "component.image-preview-dialog",
      "kind": "component",
      "status": "new-additive",
      "purpose": "Accessible click-to-preview with Escape/close/focus return and alt text."
    },
    {
      "id": "component.content-graph",
      "kind": "component",
      "status": "new-additive",
      "purpose": "Single versioned data source for route labels, media placement and cross-links."
    }
  ],
  "media": [
    {
      "src": "1000202903.png",
      "file": "blacked-aircomfort-pink-campaign-board.webp",
      "id": "asset.p2.aircomfort.pink-board",
      "title": "BLACKED AirComfort — Pink Campaign Board",
      "group": "aircomfort-concepts",
      "route": "innerwear",
      "brand": "BLACKED (wordmark visible)",
      "brandStatus": "wordmark-visible-ownership-unverified",
      "placement": "Innerwear → Concept Lab → AirComfort Cooling Concepts",
      "role": "Campaign concept board",
      "alt": "Pink AirComfort cooling-innerwear concept advertisement with an adult fashion model and feature-panel artwork.",
      "tags": [
        "concept-only",
        "cooling-innerwear",
        "campaign-board"
      ],
      "note": "All cooling, fabric, moisture, noise and battery claims shown in the artwork are unverified. Do not represent it as a verified product or active SKU.",
      "path": "phase2-assets/blacked-aircomfort-pink-campaign-board.webp",
      "width": 1024,
      "height": 1536,
      "sourceBytes": 403511,
      "webpBytes": 292282,
      "sourceSha256": "26712f0db5f844f924738faf658fedbe5449cca7c0426ecde53b672ac017c42c",
      "webpSha256": "3eb7f007f933b27d6387c4f03bf612b63b6609339ca3693b6f20f9abfec570b7",
      "rightsStatus": "user-supplied; public/commercial permissions not independently verified",
      "claimStatus": "unverified-concept-art-claims",
      "publicationStatus": "review-only; do not publish until content-host policy and rights checks pass",
      "sourceFile": "1000202903.png",
      "sectionEyebrow": "INNERWEAR · CONCEPT LAB",
      "sectionTitle": "AirComfort / Cooling Innerwear Concepts",
      "sectionIntro": "Three campaign variants/details from one experimental concept family. The images do not verify that the cooling module works or is safe.",
      "statusLabel": "Concept only · claims unverified"
    },
    {
      "src": "1000202900.png",
      "file": "blacked-aircomfort-detail-panel.webp",
      "id": "asset.p2.aircomfort.detail-board",
      "title": "BLACKED AirComfort — Feature Detail Board",
      "group": "aircomfort-concepts",
      "route": "innerwear",
      "brand": "BLACKED (wordmark visible)",
      "brandStatus": "wordmark-visible-ownership-unverified",
      "placement": "Innerwear → Concept Lab → AirComfort Cooling Concepts",
      "role": "Alternate feature / detail board",
      "alt": "AirComfort pink cooling-innerwear campaign layout with detachable module illustrations and fabric detail panels.",
      "tags": [
        "concept-only",
        "cooling-innerwear",
        "alternate-creative"
      ],
      "note": "Alternative artwork for the same AirComfort concept family, not a separate SKU. Technical claims, materials, safety and battery performance require supplier documentation.",
      "path": "phase2-assets/blacked-aircomfort-detail-panel.webp",
      "width": 1024,
      "height": 1536,
      "sourceBytes": 392684,
      "webpBytes": 282208,
      "sourceSha256": "e64ae2a565c0deff95e5a7f582cf28a20b4e0f44ebd4e296aa4371c540158c8c",
      "webpSha256": "e8d986af35fec3553113974dff9e653e58f4ae53e85dd33932af163ed9a4b712",
      "rightsStatus": "user-supplied; public/commercial permissions not independently verified",
      "claimStatus": "unverified-concept-art-claims",
      "publicationStatus": "review-only; do not publish until content-host policy and rights checks pass",
      "sourceFile": "1000202900.png",
      "sectionEyebrow": "INNERWEAR · CONCEPT LAB",
      "sectionTitle": "AirComfort / Cooling Innerwear Concepts",
      "sectionIntro": "Three campaign variants/details from one experimental concept family. The images do not verify that the cooling module works or is safe.",
      "statusLabel": "Concept only · claims unverified"
    },
    {
      "src": "1000202899.png",
      "file": "blacked-aircomfort-maroon-variant.webp",
      "id": "asset.p2.aircomfort.maroon-variant",
      "title": "BLACKED AirComfort — Maroon Variant Concept",
      "group": "aircomfort-concepts",
      "route": "innerwear",
      "brand": "BLACKED (wordmark visible)",
      "brandStatus": "wordmark-visible-ownership-unverified",
      "placement": "Innerwear → Concept Lab → AirComfort Cooling Concepts",
      "role": "Alternate colour / styling concept",
      "alt": "Maroon lace lingerie and cooling-module product concept shown in a technical campaign board.",
      "tags": [
        "concept-only",
        "cooling-innerwear",
        "colour-variant"
      ],
      "note": "The maroon bra image is a visual variant only. It does not prove the fan module is manufactured, safe, compatible, washable or commercially available.",
      "path": "phase2-assets/blacked-aircomfort-maroon-variant.webp",
      "width": 1227,
      "height": 1536,
      "sourceBytes": 419424,
      "webpBytes": 294740,
      "sourceSha256": "bfc3aadeb9d4b67fb92a4ec0b3434eecc511000eaa209bb3b78c86d5f8c622ba",
      "webpSha256": "dbd5512b1e9090c2e1eee7625f1bfdb5807018cde38b706fca11887935ff5615",
      "rightsStatus": "user-supplied; public/commercial permissions not independently verified",
      "claimStatus": "unverified-concept-art-claims",
      "publicationStatus": "review-only; do not publish until content-host policy and rights checks pass",
      "sourceFile": "1000202899.png",
      "sectionEyebrow": "INNERWEAR · CONCEPT LAB",
      "sectionTitle": "AirComfort / Cooling Innerwear Concepts",